time_of_day,meal,dietary_preferences,ingredients,cuisine
Breakfast,French Toast,prefer almond milk," almond milk, eggs, butter, vanilla, sugar, cinnamon, brioche",American
Lunch,Fettuccine,N/A," pasta, garlic, onions, heavy cream, milk, onion powder, garlic powder, chilli flakes",Italian
Dinner,Fried chicken,allergic to nuts," chicken, milk, eggs, flour, bread crumbs, paprika, onion powder, garlic powder, salt and pepper",American
Breakfast,Pancakes,no peanut butter,"milk, eggs, flower, vanilla, choclate, protein powder",American
Lunch,Spaghetti,vegan," pasta, tomato sauce, vegan ground beef, vegan cheese, salt and pepper, italian seasoning, oregano ",Italian
Dinner,Pizza,gluten free," gluten free dough, marinara, pepperoni, veggies",Italian
Breakfast,Club sandwich,N/A," toast, mayonnaise, hot sauce, lettuce, cheese, onions, tomato, chicken/ turkey",American
